{
  "summary": {
    "changedLineCount": 162,
    "replacementCount": 43,
    "repeatedReplacementCount": 20,
    "topReplacements": [
      {
        "from": "Justice",
        "to": "Justas",
        "count": 26,
        "headers": [
          "[u0012 | 00:01:03.220-00:01:10.720 | DM]",
          "[u0013 | 00:01:10.880-00:01:27.500 | DM]",
          "[u0043 | 00:04:04.740-00:04:08.490 | DM]",
          "[u0048 | 00:04:37.040-00:04:47.570 | DM]",
          "[u0056 | 00:05:38.710-00:05:47.380 | DM]",
          "[u0065 | 00:06:32.670-00:06:33.690 | DM]",
          "[u0382 | 00:29:24.180-00:29:26.890 | Finnan]",
          "[u0502 | 00:37:21.470-00:37:32.219 | DM]",
          "[u0842 | 01:00:54.870-01:01:00.299 | Finnan]",
          "[u0844 | 01:01:05.820-01:01:08.860 | DM]",
          "[u0922 | 01:06:55.080-01:06:59.030 | DM]",
          "[u0925 | 01:07:08.190-01:07:11.850 | DM]",
          "[u0927 | 01:07:18.320-01:07:20.280 | Justas]",
          "[u0990 | 01:10:24.880-01:10:27.229 | Finnan]",
          "[u0991 | 01:10:27.810-01:10:34.979 | DM]",
          "[u1007 | 01:11:25.430-01:11:30.790 | Justas]",
          "[u1225 | 01:24:27.930-01:24:33.139 | DM]",
          "[u1267 | 01:26:44.950-01:26:52.509 | Finnan]",
          "[u1291 | 01:28:59.620-01:29:02.199 | DM]",
          "[u1430 | 01:38:29.070-01:38:31.290 | Justas]",
          "[u1483 | 01:42:50.250-01:42:59.670 | Justas]",
          "[u1513 | 01:45:21.000-01:45:23.270 | Justas]",
          "[u1521 | 01:45:45.960-01:45:52.399 | Jrain]",
          "[u1920 | 02:19:11.319-02:19:18.579 | DM]",
          "[u1942 | 02:21:26.190-02:21:31.889 | DM]",
          "[u2003 | 02:27:19.820-02:27:27.609 | Justas]"
        ]
      },
      {
        "from": "YOLO",
        "to": "Eolo",
        "count": 24,
        "headers": [
          "[u0022 | 00:02:03.740-00:02:06.730 | Finnan]",
          "[u0025 | 00:02:21.420-00:02:25.830 | Finnan]",
          "[u0118 | 00:10:09.060-00:10:16.040 | DM]",
          "[u0125 | 00:10:39.690-00:10:47.280 | DM]",
          "[u0128 | 00:11:01.000-00:11:05.860 | DM]",
          "[u0210 | 00:16:40.940-00:16:47.519 | Eolo]",
          "[u0328 | 00:25:03.080-00:25:09.879 | DM]",
          "[u1019 | 01:12:19.930-01:12:25.949 | Jrain]",
          "[u1104 | 01:17:32.110-01:17:34.829 | Finnan]",
          "[u1285 | 01:28:29.500-01:28:33.140 | DM]",
          "[u1336 | 01:31:19.710-01:31:20.590 | DM]",
          "[u1339 | 01:31:27.650-01:31:28.970 | Finnan]",
          "[u1672 | 01:57:49.680-01:57:55.470 | Finnan]",
          "[u1683 | 01:58:31.370-01:58:37.050 | DM]",
          "[u1814 | 02:08:41.750-02:08:42.650 | DM]",
          "[u2291 | 02:54:00.380-02:54:11.000 | Ekko]",
          "[u2311 | 02:55:36.170-02:55:40.680 | Ekko]",
          "[u2349 | 02:58:55.750-02:59:03.360 | Ekko]",
          "[u2351 | 02:59:14.410-02:59:21.010 | Ekko]",
          "[u2442 | 03:07:10.400-03:07:13.500 | Ekko]",
          "[u2530 | 03:14:55.390-03:15:02.119 | Eolo]",
          "[u2535 | 03:15:11.140-03:15:16.469 | Ekko]"
        ]
      },
      {
        "from": "Echo",
        "to": "Ekko",
        "count": 22,
        "headers": [
          "[u0036 | 00:03:02.910-00:03:07.840 | Finnan]",
          "[u0076 | 00:07:15.020-00:07:17.299 | DM]",
          "[u0175 | 00:13:52.680-00:14:00.229 | Ekko]",
          "[u0391 | 00:30:15.150-00:30:18.459 | DM]",
          "[u0392 | 00:30:20.590-00:30:22.190 | DM]",
          "[u0412 | 00:31:53.890-00:31:59.020 | Finnan]",
          "[u0494 | 00:36:36.290-00:36:43.310 | DM]",
          "[u0508 | 00:38:05.350-00:38:09.880 | Finnan]",
          "[u0848 | 01:01:23.500-01:01:25.650 | DM]",
          "[u1155 | 01:20:18.920-01:20:23.440 | Ekko]",
          "[u1197 | 01:22:39.710-01:22:41.050 | DM]",
          "[u1233 | 01:24:50.530-01:24:52.329 | DM]",
          "[u1717 | 02:01:47.710-02:01:51.299 | Ekko]",
          "[u1726 | 02:02:11.430-02:02:31.239 | DM]",
          "[u1975 | 02:24:25.840-02:24:44.880 | DM]",
          "[u2181 | 02:44:22.550-02:44:25.350 | Ekko]",
          "[u2184 | 02:44:28.360-02:44:34.150 | DM]",
          "[u2195 | 02:45:13.900-02:45:19.539 | Ekko]",
          "[u2199 | 02:45:30.480-02:45:36.960 | Ekko]",
          "[u2203 | 02:45:41.830-02:45:50.300 | Ekko]",
          "[u2291 | 02:54:00.380-02:54:11.000 | Ekko]",
          "[u2457 | 03:08:23.620-03:08:30.020 | DM]"
        ]
      },
      {
        "from": "Gustavo",
        "to": "Kestavo",
        "count": 16,
        "headers": [
          "[u1921 | 02:19:18.689-02:19:26.419 | DM]",
          "[u1979 | 02:24:58.680-02:25:02.379 | Justas]",
          "[u1984 | 02:25:25.610-02:25:31.390 | Justas]",
          "[u1989 | 02:25:51.930-02:26:03.729 | DM]",
          "[u1991 | 02:26:04.840-02:26:07.270 | DM]",
          "[u1994 | 02:26:20.000-02:26:33.309 | DM]",
          "[u2001 | 02:27:03.720-02:27:14.209 | DM]",
          "[u2003 | 02:27:19.820-02:27:27.609 | Justas]",
          "[u2008 | 02:27:38.850-02:27:48.350 | DM]",
          "[u2032 | 02:29:49.030-02:29:56.110 | Finnan]",
          "[u2034 | 02:29:59.760-02:30:08.839 | DM]",
          "[u2036 | 02:30:18.880-02:30:33.449 | DM]",
          "[u2038 | 02:30:37.980-02:30:47.109 | DM]",
          "[u2039 | 02:30:47.760-02:31:02.139 | DM]",
          "[u2041 | 02:31:09.150-02:31:23.980 | DM]"
        ]
      },
      {
        "from": "justice",
        "to": "Justas",
        "count": 12,
        "headers": [
          "[u0045 | 00:04:13.710-00:04:15.300 | DM]",
          "[u0534 | 00:40:16.730-00:40:22.769 | DM]",
          "[u0756 | 00:54:14.060-00:54:23.610 | Finnan]",
          "[u0757 | 00:54:24.240-00:54:27.080 | Finnan]",
          "[u0774 | 00:55:45.540-00:55:51.529 | Jrain]",
          "[u0775 | 00:55:52.060-00:55:55.809 | DM]",
          "[u0812 | 00:58:45.020-00:58:55.560 | Finnan]",
          "[u1460 | 01:40:54.590-01:41:04.429 | DM]",
          "[u1465 | 01:41:16.830-01:41:21.259 | Finnan]",
          "[u1684 | 01:58:37.210-01:58:39.910 | DM]",
          "[u1977 | 02:24:48.360-02:24:56.939 | DM]"
        ]
      },
      {
        "from": "Finian",
        "to": "Finnan",
        "count": 11,
        "headers": [
          "[u0584 | 00:43:33.260-00:43:44.499 | DM]",
          "[u0929 | 01:07:26.420-01:07:28.600 | DM]",
          "[u1025 | 01:12:56.200-01:13:08.489 | DM]",
          "[u1204 | 01:23:05.900-01:23:08.790 | DM]",
          "[u1280 | 01:27:59.320-01:28:03.860 | DM]",
          "[u1613 | 01:53:52.280-01:53:57.580 | Finnan]",
          "[u1942 | 02:21:26.190-02:21:31.889 | DM]",
          "[u1968 | 02:23:39.050-02:23:49.480 | DM]",
          "[u2024 | 02:29:13.050-02:29:21.950 | DM]",
          "[u2417 | 03:04:56.060-03:05:06.910 | DM]"
        ]
      },
      {
        "from": "Yolo",
        "to": "Eolo",
        "count": 11,
        "headers": [
          "[u0032 | 00:02:46.000-00:02:48.920 | Finnan]",
          "[u0250 | 00:18:59.720-00:19:07.259 | DM]",
          "[u0345 | 00:26:19.190-00:26:27.800 | Finnan]",
          "[u0502 | 00:37:21.470-00:37:32.219 | DM]",
          "[u0639 | 00:47:27.600-00:47:29.309 | DM]",
          "[u0640 | 00:47:29.970-00:47:38.699 | Finnan]",
          "[u1095 | 01:17:11.960-01:17:13.090 | DM]",
          "[u1143 | 01:19:35.160-01:19:37.730 | Ekko]",
          "[u1806 | 02:08:25.810-02:08:28.810 | Eolo]",
          "[u1974 | 02:24:13.800-02:24:25.550 | DM]",
          "[u2543 | 03:15:46.550-03:15:49.680 | Eolo]"
        ]
      },
      {
        "from": "Drain",
        "to": "Jrain",
        "count": 8,
        "headers": [
          "[u0012 | 00:01:03.220-00:01:10.720 | DM]",
          "[u0264 | 00:20:01.140-00:20:04.300 | DM]",
          "[u0345 | 00:26:19.190-00:26:27.800 | Finnan]",
          "[u0591 | 00:44:11.980-00:44:16.510 | DM]",
          "[u0709 | 00:51:32.730-00:51:41.610 | DM]",
          "[u1025 | 01:12:56.200-01:13:08.489 | DM]",
          "[u1159 | 01:20:31.710-01:20:32.650 | DM]",
          "[u1782 | 02:07:07.750-02:07:09.540 | Finnan]"
        ]
      },
      {
        "from": "yellow",
        "to": "Eolo",
        "count": 5,
        "headers": [
          "[u0645 | 00:47:46.870-00:47:49.729 | Finnan]",
          "[u1153 | 01:20:03.070-01:20:14.340 | DM]",
          "[u1288 | 01:28:39.930-01:28:41.670 | DM]",
          "[u1358 | 01:32:25.070-01:32:27.580 | Ekko]"
        ]
      },
      {
        "from": "Faye",
        "to": "Fae",
        "count": 4,
        "headers": [
          "[u1589 | 01:52:15.780-01:52:19.649 | Finnan]",
          "[u1629 | 01:55:14.710-01:55:20.120 | DM]",
          "[u1635 | 01:55:40.410-01:55:44.780 | DM]",
          "[u1636 | 01:55:46.360-01:55:48.350 | DM]"
        ]
      }
    ],
    "uniqueUnresolvedPhrases": []
  },
  "lineCount": 2586,
  "changedLineCount": 162,
  "validationErrors": [],
  "unresolvedCount": 0,
  "unresolvedPhrases": [],
  "changedLines": [
    {
      "header": "[u0012 | 00:01:03.220-00:01:10.720 | DM]",
      "lineNumber": 12,
      "originalText": "Drain has a light spell on an arrow, and Justice has a light spell… oh, maybe… no, cause…",
      "cleanedText": "Jrain has a light spell on an arrow, and Justas has a light spell… oh, maybe… no, cause…"
    },
    {
      "header": "[u0013 | 00:01:10.880-00:01:27.500 | DM]",
      "lineNumber": 13,
      "originalText": "Kalima is hiding in the illusion, so would have passed off the light spell, one presumes. Yeah. So, I guess Justice has the light. You can see some here. So, everybody's slid down into this space, and there's this beast here.",
      "cleanedText": "Kalima is hiding in the illusion, so would have passed off the light spell, one presumes. Yeah. So, I guess Justas has the light. You can see some here. So, everybody's slid down into this space, and there's this beast here."
    },
    {
      "header": "[u0022 | 00:02:03.740-00:02:06.730 | Finnan]",
      "lineNumber": 22,
      "originalText": "Where's YOLO? Because I'm riding on YOLO's back.",